{
  "meta": {
    "schema_version": "1.0.0",
    "product": "teaser_intake",
    "intake_id": "TI-20261019-SAMPLE1",
    "report_id": null,
    "generated_at": "2026-10-19T10:00:00+08:00",
    "as_of": "2026-10-19",
    "locale": "en-PH",
    "currency": "PHP",
    "relationship": "received_from_network",
    "run": {
      "run_id": "run_sample_ti_01",
      "dag_id": "grid.teaser_intake",
      "dag_version": "0.1.0",
      "nodes": [
        {
          "node_id": "T00_teaser_upload",
          "status": "succeeded"
        },
        {
          "node_id": "T01_file_triage",
          "status": "succeeded"
        },
        {
          "node_id": "T02_read_teaser",
          "status": "succeeded"
        },
        {
          "node_id": "T04_extract_facts",
          "status": "succeeded"
        },
        {
          "node_id": "T05_map_to_intake",
          "status": "succeeded"
        },
        {
          "node_id": "T06_locate",
          "status": "succeeded"
        },
        {
          "node_id": "T07_claim_research",
          "status": "succeeded"
        },
        {
          "node_id": "T08_claim_review",
          "status": "succeeded"
        },
        {
          "node_id": "T03_listen_video",
          "status": "skipped"
        }
      ]
    }
  },
  "files": [
    {
      "doc_ref": "doc-1",
      "kind": "image",
      "pages": 1,
      "duration_s": null,
      "sha256": "1ec32c5a71a7312eff7c5fdf9d5435b1ad0670805c1d1ac59364d304d868b3b7",
      "near_duplicate_of": null,
      "readable": "yes",
      "language": "en",
      "content_kinds": [
        "teaser_graphic",
        "site_photo"
      ]
    },
    {
      "doc_ref": "doc-2",
      "kind": "pasted_text",
      "pages": null,
      "duration_s": null,
      "sha256": "07015f31d432600f0c7fc48be2d0eadd6c32cc272450c6ba7ddc52cb9c28873a",
      "near_duplicate_of": null,
      "readable": "yes",
      "language": "taglish",
      "content_kinds": [
        "listing_post_text"
      ]
    }
  ],
  "listing": {
    "headline_as_written": "FOR SALE • RUSH! PRIME COMMERCIAL LOT, C6 Road, Calzada-Tipas, Taguig City",
    "property_type": "vacant commercial lot",
    "canonical_intended_use": "commercial",
    "deal": "sale",
    "facts": [
      {
        "key": "property_type",
        "label": "Property type",
        "value_text": "PRIME COMMERCIAL LOT",
        "figure": null,
        "status": "owner_input",
        "source": {
          "doc_ref": "doc-1",
          "page": 1,
          "timestamp_s": null,
          "quote": "PRIME COMMERCIAL LOT"
        },
        "confidence": "high",
        "conflict": null
      },
      {
        "key": "lot_area",
        "label": "Lot area",
        "value_text": "14,323 sqm",
        "figure": {
          "value": 14323,
          "range": null,
          "unit": "sqm",
          "scale": "one",
          "basis": "not_applicable",
          "as_of": "2026-10-19",
          "status": "owner_input",
          "source_ids": [],
          "note": "From the teaser graphic."
        },
        "status": "owner_input",
        "source": {
          "doc_ref": "doc-1",
          "page": 1,
          "timestamp_s": null,
          "quote": "14,323 sqm"
        },
        "confidence": "high",
        "conflict": "The Viber post says \"1.4 has more or less\" (about 14,000 sqm); the graphic says 14,323 sqm. Difference about 2.3%."
      },
      {
        "key": "lot_area_post",
        "label": "Lot area (post)",
        "value_text": "1.4 has more or less",
        "figure": {
          "value": 14000,
          "range": null,
          "unit": "sqm",
          "scale": "one",
          "basis": "not_applicable",
          "as_of": "2026-10-19",
          "status": "estimate",
          "source_ids": [],
          "note": "1.4 hectares x 10,000; \"more or less\" in the post."
        },
        "status": "estimate",
        "source": {
          "doc_ref": "doc-2",
          "page": 1,
          "timestamp_s": null,
          "quote": "1.4 has more or less"
        },
        "confidence": "medium",
        "conflict": "Differs from the 14,323 sqm on the graphic."
      },
      {
        "key": "asking_price_per_sqm",
        "label": "Asking price per sqm",
        "value_text": "₱42,000/sqm",
        "figure": {
          "value": 42000,
          "range": null,
          "unit": "PHP/sqm",
          "scale": "one",
          "basis": "asking",
          "as_of": "2026-10-19",
          "status": "owner_input",
          "source_ids": [],
          "note": ""
        },
        "status": "owner_input",
        "source": {
          "doc_ref": "doc-1",
          "page": 1,
          "timestamp_s": null,
          "quote": "₱42,000/sqm"
        },
        "confidence": "high",
        "conflict": null
      },
      {
        "key": "asking_price_total",
        "label": "Asking price, total",
        "value_text": "₱600M total",
        "figure": {
          "value": 600000000,
          "range": null,
          "unit": "PHP",
          "scale": "one",
          "basis": "asking",
          "as_of": "2026-10-19",
          "status": "owner_input",
          "source_ids": [],
          "note": "14,323 sqm x PHP 42,000 = PHP 601,566,000; the stated PHP 600M is 0.26% lower (rounding)."
        },
        "status": "owner_input",
        "source": {
          "doc_ref": "doc-1",
          "page": 1,
          "timestamp_s": null,
          "quote": "₱600M total"
        },
        "confidence": "high",
        "conflict": null
      },
      {
        "key": "location",
        "label": "Location",
        "value_text": "C6 Road, Calzada-Tipas, Taguig City",
        "figure": null,
        "status": "owner_input",
        "source": {
          "doc_ref": "doc-1",
          "page": 1,
          "timestamp_s": null,
          "quote": "C6 Road, Calzada-Tipas, Taguig City"
        },
        "confidence": "high",
        "conflict": null
      },
      {
        "key": "road_access",
        "label": "Road access",
        "value_text": "Along C6 Road",
        "figure": null,
        "status": "owner_input",
        "source": {
          "doc_ref": "doc-1",
          "page": 1,
          "timestamp_s": null,
          "quote": "Along C6 Road"
        },
        "confidence": "high",
        "conflict": null
      },
      {
        "key": "title_type",
        "label": "Title",
        "value_text": "Clean Title (TCT)",
        "figure": null,
        "status": "owner_input",
        "source": {
          "doc_ref": "doc-1",
          "page": 1,
          "timestamp_s": null,
          "quote": "Clean Title (TCT)"
        },
        "confidence": "high",
        "conflict": null
      },
      {
        "key": "zoning_claim",
        "label": "Zoning (claimed)",
        "value_text": "Zoned Commercial",
        "figure": null,
        "status": "owner_input",
        "source": {
          "doc_ref": "doc-1",
          "page": 1,
          "timestamp_s": null,
          "quote": "Zoned Commercial"
        },
        "confidence": "high",
        "conflict": null
      },
      {
        "key": "flood_claim",
        "label": "Flooding (claimed)",
        "value_text": "Flood-free / Hindi binabaha",
        "figure": null,
        "status": "owner_input",
        "source": {
          "doc_ref": "doc-1",
          "page": 1,
          "timestamp_s": null,
          "quote": "Flood-free"
        },
        "confidence": "high",
        "conflict": null
      },
      {
        "key": "infrastructure_claim",
        "label": "Nearby project (claimed)",
        "value_text": "Near future C6 Expressway",
        "figure": null,
        "status": "owner_input",
        "source": {
          "doc_ref": "doc-1",
          "page": 1,
          "timestamp_s": null,
          "quote": "Near future C6 Expressway"
        },
        "confidence": "high",
        "conflict": null
      },
      {
        "key": "price_claim",
        "label": "Price claim",
        "value_text": "BELOW MARKET!",
        "figure": null,
        "status": "owner_input",
        "source": {
          "doc_ref": "doc-1",
          "page": 1,
          "timestamp_s": null,
          "quote": "BELOW MARKET!"
        },
        "confidence": "high",
        "conflict": null
      },
      {
        "key": "suggested_uses",
        "label": "Suggested uses",
        "value_text": "Ideal for warehouse • showroom • mixed-use",
        "figure": null,
        "status": "owner_input",
        "source": {
          "doc_ref": "doc-1",
          "page": 1,
          "timestamp_s": null,
          "quote": "Ideal for warehouse • showroom • mixed-use"
        },
        "confidence": "high",
        "conflict": null
      },
      {
        "key": "terms",
        "label": "Terms",
        "value_text": "Cash basis, negotiable",
        "figure": null,
        "status": "owner_input",
        "source": {
          "doc_ref": "doc-1",
          "page": 1,
          "timestamp_s": null,
          "quote": "Cash basis, negotiable"
        },
        "confidence": "high",
        "conflict": null
      },
      {
        "key": "commission_offered",
        "label": "Commission offered to co-brokers",
        "value_text": "3% commission shared to co-brokers",
        "figure": {
          "value": 3,
          "range": null,
          "unit": "%",
          "scale": "one",
          "basis": "not_applicable",
          "as_of": "2026-10-19",
          "status": "owner_input",
          "source_ids": [],
          "note": ""
        },
        "status": "owner_input",
        "source": {
          "doc_ref": "doc-1",
          "page": 1,
          "timestamp_s": null,
          "quote": "3% commission shared to co-brokers"
        },
        "confidence": "high",
        "conflict": null
      },
      {
        "key": "authority_claim",
        "label": "Authority (claimed)",
        "value_text": "direct sa owner via authorized broker",